{
  "version": 2,
  "lastUpdated": "2026-05-10T13:26:56.516Z",
  "approvedCategories": [
    "scripture",
    "courage",
    "encouragement",
    "healing",
    "hope",
    "identity",
    "peace",
    "perseverance",
    "purpose",
    "wisdom"
  ],
  "challenges": [
    {
      "id": "scripture-breathe-receive",
      "challenge": "Take six slow breaths and silently repeat: I can receive what is good today.",
      "categories": [
        "scripture",
        "peace"
      ],
      "approved": true,
      "active": true
    },
    {
      "id": "scripture-one-line-blessing",
      "challenge": "Write one simple blessing over the choice in front of you.",
      "categories": [
        "scripture",
        "hope"
      ],
      "approved": true,
      "active": true
    },
    {
      "id": "scripture-ask-seek-knock",
      "challenge": "Ask for clarity in one sentence, seek one next step, then knock by taking it.",
      "categories": [
        "scripture",
        "purpose"
      ],
      "approved": true,
      "active": true
    },
    {
      "id": "scripture-release-burden",
      "challenge": "Name one burden you do not have to carry alone today.",
      "categories": [
        "scripture",
        "healing"
      ],
      "approved": true,
      "active": true
    },
    {
      "id": "scripture-stillness-minute",
      "challenge": "Sit still for one minute and let your next action come from quiet instead of pressure.",
      "categories": [
        "scripture",
        "wisdom"
      ],
      "approved": true,
      "active": true
    },
    {
      "id": "scripture-kindness-offering",
      "challenge": "Offer one quiet act of kindness without needing it to be noticed.",
      "categories": [
        "scripture",
        "encouragement"
      ],
      "approved": true,
      "active": true
    },
    {
      "id": "scripture-peace-check",
      "challenge": "Before responding, ask what would make this answer more peaceful and true.",
      "categories": [
        "scripture",
        "peace"
      ],
      "approved": true,
      "active": true
    },
    {
      "id": "scripture-courage-step",
      "challenge": "Take one faithful step that is small enough to do now.",
      "categories": [
        "scripture",
        "courage"
      ],
      "approved": true,
      "active": true
    },
    {
      "id": "scripture-gratitude-line",
      "challenge": "Write one line of thanks for something that is already supporting you.",
      "categories": [
        "scripture",
        "hope"
      ],
      "approved": true,
      "active": true
    },
    {
      "id": "scripture-guided-choice",
      "challenge": "Place a hand on your chest and ask what choice feels honest, loving, and grounded.",
      "categories": [
        "scripture",
        "identity"
      ],
      "approved": true,
      "active": true
    },
    {
      "id": "courage-one-honest-sentence",
      "challenge": "Write one honest sentence you have been avoiding and leave it somewhere private.",
      "categories": [
        "courage",
        "identity"
      ],
      "approved": true,
      "active": true
    },
    {
      "id": "courage-send-clear-note",
      "challenge": "Send or draft one clear sentence that says what you mean without overexplaining.",
      "categories": [
        "courage",
        "peace"
      ],
      "approved": true,
      "active": true
    },
    {
      "id": "courage-name-the-fear",
      "challenge": "Name the fear underneath one delay, then choose the smallest next action.",
      "categories": [
        "courage",
        "wisdom"
      ],
      "approved": true,
      "active": true
    },
    {
      "id": "courage-two-minute-start",
      "challenge": "Start the task you are avoiding for two minutes and stop when the timer ends.",
      "categories": [
        "courage",
        "perseverance"
      ],
      "approved": true,
      "active": true
    },
    {
      "id": "courage-stand-tall",
      "challenge": "Stand with both feet grounded for five breaths before your next difficult choice.",
      "categories": [
        "courage",
        "identity"
      ],
      "approved": true,
      "active": true
    },
    {
      "id": "courage-ask-for-need",
      "challenge": "Ask for one small thing you actually need today.",
      "categories": [
        "courage",
        "healing"
      ],
      "approved": true,
      "active": true
    },
    {
      "id": "courage-boundary-draft",
      "challenge": "Draft one respectful boundary sentence you could use later.",
      "categories": [
        "courage",
        "identity"
      ],
      "approved": true,
      "active": true
    },
    {
      "id": "courage-choose-visible-good",
      "challenge": "Do one good thing that your future self will be glad you chose.",
      "categories": [
        "courage",
        "purpose"
      ],
      "approved": true,
      "active": true
    },
    {
      "id": "courage-repair-one-miss",
      "challenge": "Make one tiny repair: apologize, clarify, reschedule, or restart.",
      "categories": [
        "courage",
        "encouragement"
      ],
      "approved": true,
      "active": true
    },
    {
      "id": "courage-let-it-be-imperfect",
      "challenge": "Complete one tiny step imperfectly instead of waiting to feel ready.",
      "categories": [
        "courage",
        "perseverance"
      ],
      "approved": true,
      "active": true
    },
    {
      "id": "encouragement-kind-note-self",
      "challenge": "Write one kind note to yourself as if you were supporting a close friend.",
      "categories": [
        "encouragement",
        "healing"
      ],
      "approved": true,
      "active": true
    },
    {
      "id": "encouragement-notice-progress",
      "challenge": "Name one sign that you are not where you used to be.",
      "categories": [
        "encouragement",
        "hope"
      ],
      "approved": true,
      "active": true
    },
    {
      "id": "encouragement-text-support",
      "challenge": "Send one genuine appreciation text to someone who has helped you.",
      "categories": [
        "encouragement",
        "peace"
      ],
      "approved": true,
      "active": true
    },
    {
      "id": "encouragement-celebrate-small",
      "challenge": "Celebrate one small action from today with one full sentence.",
      "categories": [
        "encouragement",
        "hope"
      ],
      "approved": true,
      "active": true
    },
    {
      "id": "encouragement-soft-start",
      "challenge": "Begin your next task by making it easier, smaller, or kinder.",
      "categories": [
        "encouragement",
        "wisdom"
      ],
      "approved": true,
      "active": true
    },
    {
      "id": "encouragement-choose-supportive-words",
      "challenge": "Replace one harsh inner phrase with words you would offer someone you love.",
      "categories": [
        "encouragement",
        "healing"
      ],
      "approved": true,
      "active": true
    },
    {
      "id": "encouragement-visible-token",
      "challenge": "Put one visible reminder near you that says: this still counts.",
      "categories": [
        "encouragement",
        "perseverance"
      ],
      "approved": true,
      "active": true
    },
    {
      "id": "encouragement-accept-help",
      "challenge": "Accept one available help, shortcut, tool, or kindness without arguing with it.",
      "categories": [
        "encouragement",
        "identity"
      ],
      "approved": true,
      "active": true
    },
    {
      "id": "encouragement-bless-next-choice",
      "challenge": "Speak one blessing over your next choice before you take it.",
      "categories": [
        "encouragement",
        "hope"
      ],
      "approved": true,
      "active": true
    },
    {
      "id": "encouragement-future-self",
      "challenge": "Ask what your future self would thank you for doing in the next two minutes.",
      "categories": [
        "encouragement",
        "purpose"
      ],
      "approved": true,
      "active": true
    },
    {
      "id": "healing-soften-one-place",
      "challenge": "Soften one place in your body for three slow breaths before making the next choice.",
      "categories": [
        "healing",
        "peace"
      ],
      "approved": true,
      "active": true
    },
    {
      "id": "healing-name-feeling",
      "challenge": "Name one feeling without fixing it, judging it, or explaining it away.",
      "categories": [
        "healing",
        "wisdom"
      ],
      "approved": true,
      "active": true
    },
    {
      "id": "healing-warm-hand",
      "challenge": "Place one hand where your body feels tense and breathe there for one minute.",
      "categories": [
        "healing",
        "peace"
      ],
      "approved": true,
      "active": true
    },
    {
      "id": "healing-choose-gentle-truth",
      "challenge": "Write one gentle truth that can sit beside the hard thing.",
      "categories": [
        "healing",
        "hope"
      ],
      "approved": true,
      "active": true
    },
    {
      "id": "healing-release-should",
      "challenge": "Cross out one should and write the real choice underneath it.",
      "categories": [
        "healing",
        "identity"
      ],
      "approved": true,
      "active": true
    },
    {
      "id": "healing-one-sip-reset",
      "challenge": "Drink water slowly and let it mark a restart in your day.",
      "categories": [
        "healing",
        "encouragement"
      ],
      "approved": true,
      "active": true
    },
    {
      "id": "healing-forgive-small-delay",
      "challenge": "Forgive yourself for one delay, then choose the next useful action.",
      "categories": [
        "healing",
        "perseverance"
      ],
      "approved": true,
      "active": true
    },
    {
      "id": "healing-clear-one-inch",